{
  "schema_version": "confirmed-fact-final-decisions.v1",
  "session_slug": "r8-dai4-teireikai",
  "artifact_type": "confirmed_fact_final_decisions",
  "artifact_origin": "hand_authored_reviewer_decision",
  "decision_status": "reviewer_only",
  "source_promotion_review": "../confirmed-fact-promotion-review/r8-dai4-teireikai.confirmed-fact-promotion-review.json",
  "source_utterance_index": "../utterance-index/r8-dai4-teireikai.utterances.json",
  "source_general_questions": "../../general_questions/r8-dai4-teireikai.general-questions.json",
  "reviewed_from_commit": "0c937a4b1bd5d310360b20f884cd889c07b011fb",
  "summary": {
    "reviewed_total": 8,
    "approve_as_written_total": 4,
    "approve_with_revision_total": 4,
    "hold_total": 0,
    "reject_total": 0
  },
  "decisions": [
    {
      "decision_id": "r8-dai4-teireikai::ishigaki-r8-dai4-ippan-shiuezato-atsushi.item03::ishigaki-r8-dai4-teireikai.gq.ishigaki-r8-dai4-ippan-shiuezato-atsushi.u0008::cf01::decision-v1",
      "candidate_id": "ishigaki-r8-dai4-ippan-shiuezato-atsushi.item03::ishigaki-r8-dai4-teireikai.gq.ishigaki-r8-dai4-ippan-shiuezato-atsushi.u0008::cf01",
      "entry_id": "ishigaki-r8-dai4-ippan-shiuezato-atsushi.item03",
      "source_utterance_id": "ishigaki-r8-dai4-teireikai.gq.ishigaki-r8-dai4-ippan-shiuezato-atsushi.u0008",
      "council_member": "後上里厚司",
      "theme_group": "公共施設・都市整備",
      "theme": "旧庁舎跡地利用の現状について",
      "item_title": "旧庁舎跡地利用の現状について: 前年度、跡地の維持管理等に対して支出された本市予算 / 跡地利用の優先交渉権者を決定した経緯 / プロポーザル１回目と２回目の基準の違い / 決定された内容の変更はあるか。",
      "original_candidate": "工事は令和7年2月に完了しております",
      "source_review_proposed_fact": "旧庁舎跡地活用事業では建物解体や基礎撤去の工事が2025年2月に完了した。",
      "decision": "approve_with_revision",
      "final_recommended_fact": "旧庁舎跡地活用事業では、建物解体などの工事が2025年2月に完了した。",
      "decision_reason": "transcript の「基礎具合撤去」に OCR / transcription 揺れがあるため、確実に確認できる建物解体と工事完了に範囲を縮めた。",
      "source_basis": "「本事業の当初スケジュールに合わせ建物解体や基礎具合撤去を実施しており、工事は令和7年2月に完了しております。」",
      "speaker_role": "executive",
      "answer_anchor_source": "direct_item_match",
      "answer_anchor_confidence": "high",
      "confidence": "medium",
      "unresolved_note": "「基礎具合撤去」の原語は、元会議録または音源での確認が必要。",
      "public_reflection_status": "not_reflected",
      "proposal_status": "not_created",
      "reviewed_at": "2026-07-11",
      "reviewer_note": "source review wording よりも public 反映前提の安全側 wording を採用した。"
    },
    {
      "decision_id": "r8-dai4-teireikai::ishigaki-r8-dai4-ippan-shiuezato-atsushi.item07::ishigaki-r8-dai4-teireikai.gq.ishigaki-r8-dai4-ippan-shiuezato-atsushi.u0011::cf01::decision-v1",
      "candidate_id": "ishigaki-r8-dai4-ippan-shiuezato-atsushi.item07::ishigaki-r8-dai4-teireikai.gq.ishigaki-r8-dai4-ippan-shiuezato-atsushi.u0011::cf01",
      "entry_id": "ishigaki-r8-dai4-ippan-shiuezato-atsushi.item07",
      "source_utterance_id": "ishigaki-r8-dai4-teireikai.gq.ishigaki-r8-dai4-ippan-shiuezato-atsushi.u0011",
      "council_member": "後上里厚司",
      "theme_group": "スポーツ・青少年交流",
      "theme": "離島甲子園について",
      "item_title": "離島甲子園について",
      "original_candidate": "派遣事業として2014年の第7回大会から中学生選抜チームを結成して派遣してきました",
      "source_review_proposed_fact": "石垣市は離島甲子園への派遣事業として、2014年の第7回大会から中学生選抜チームを結成して派遣してきた。",
      "decision": "approve_as_written",
      "final_recommended_fact": "石垣市は離島甲子園への派遣事業として、2014年の第7回大会から中学生選抜チームを結成して派遣してきた。",
      "decision_reason": "主語・開始年・大会回数・継続してきた事実が原文に直接あり、意味の追加や欠落がない。",
      "source_basis": "「本市においても離島甲子園の開催目的に賛同し、派遣事業として2014年の第7回大会から中学生選抜チームを結成して派遣してきました。」",
      "speaker_role": "executive",
      "answer_anchor_source": "direct_item_match",
      "answer_anchor_confidence": "high",
      "confidence": "high",
      "unresolved_note": "",
      "public_reflection_status": "not_reflected",
      "proposal_status": "not_created",
      "reviewed_at": "2026-07-11",
      "reviewer_note": "source review wording をそのまま最終候補として採用可能と判断した。"
    },
    {
      "decision_id": "r8-dai4-teireikai::ishigaki-r8-dai4-ippan-takara-munenori.item01::ishigaki-r8-dai4-teireikai.gq.ishigaki-r8-dai4-ippan-takara-munenori.u0010::cf01::decision-v1",
      "candidate_id": "ishigaki-r8-dai4-ippan-takara-munenori.item01::ishigaki-r8-dai4-teireikai.gq.ishigaki-r8-dai4-ippan-takara-munenori.u0010::cf01",
      "entry_id": "ishigaki-r8-dai4-ippan-takara-munenori.item01",
      "source_utterance_id": "ishigaki-r8-dai4-teireikai.gq.ishigaki-r8-dai4-ippan-takara-munenori.u0010",
      "council_member": "髙良宗矩",
      "theme_group": "子育て・教育",
      "theme": "日本一安心して子育てできる街・若い方々が帰れる街・住み続けられる街に向けた取組について",
      "item_title": "日本一安心して子育てできる街・若い方々が帰れる街・住み続けられる街に向けた取組について: クーポンを用いた「すくすく応援事業」利用状況及び利用者の声について / 雨天時及び猛暑時にも利用可能な公園や室内遊戯施設整備について / 食物アレルギーを持つ子どもへの支援の現状について / 保育園等入園入所に係るオンライン申請の進捗について / 多胎児家庭への支援の現状及び今後の拡充について / 「部活動等指導環境充実化構築事業」終了後の財源確保について",
      "original_candidate": "お子様1人当たり24,000円のクーポン券を配布しております",
      "source_review_proposed_fact": "すくすく応援事業では、1歳の誕生日月まで子ども1人当たり24,000円のクーポン券を配布している。",
      "decision": "approve_as_written",
      "final_recommended_fact": "すくすく応援事業では、1歳の誕生日月まで子ども1人当たり24,000円のクーポン券を配布している。",
      "decision_reason": "事業名、対象、期間、金額が同一答弁内で閉じており、そのまま public fact 候補として読める。",
      "source_basis": "「市内のベビー用品を販売する店舗で、おむつやミルク、ベビーフード等の購入に使用できるクーポン券を、1歳の誕生日月まで、お子様1人当たり24,000円のクーポン券を配布しております。」",
      "speaker_role": "executive",
      "answer_anchor_source": "direct_item_match",
      "answer_anchor_confidence": "high",
      "confidence": "high",
      "unresolved_note": "",
      "public_reflection_status": "not_reflected",
      "proposal_status": "not_created",
      "reviewed_at": "2026-07-11",
      "reviewer_note": "金額・対象・期間とも追加補足不要と判断した。"
    },
    {
      "decision_id": "r8-dai4-teireikai::ishigaki-r8-dai4-ippan-takara-munenori.item01::ishigaki-r8-dai4-teireikai.gq.ishigaki-r8-dai4-ippan-takara-munenori.u0017::cf02::decision-v1",
      "candidate_id": "ishigaki-r8-dai4-ippan-takara-munenori.item01::ishigaki-r8-dai4-teireikai.gq.ishigaki-r8-dai4-ippan-takara-munenori.u0017::cf02",
      "entry_id": "ishigaki-r8-dai4-ippan-takara-munenori.item01",
      "source_utterance_id": "ishigaki-r8-dai4-teireikai.gq.ishigaki-r8-dai4-ippan-takara-munenori.u0017",
      "council_member": "髙良宗矩",
      "theme_group": "子育て・教育",
      "theme": "日本一安心して子育てできる街・若い方々が帰れる街・住み続けられる街に向けた取組について",
      "item_title": "日本一安心して子育てできる街・若い方々が帰れる街・住み続けられる街に向けた取組について: クーポンを用いた「すくすく応援事業」利用状況及び利用者の声について / 雨天時及び猛暑時にも利用可能な公園や室内遊戯施設整備について / 食物アレルギーを持つ子どもへの支援の現状について / 保育園等入園入所に係るオンライン申請の進捗について / 多胎児家庭への支援の現状及び今後の拡充について / 「部活動等指導環境充実化構築事業」終了後の財源確保について",
      "original_candidate": "中学生の保護者を対象に月額3250円を補助する負担軽減策を講じました",
      "source_review_proposed_fact": "2026年4月に石垣市学校給食弁当代替者補助要項を制定し、中学生の保護者向けに月額3,250円の補助を始めた。",
      "decision": "approve_with_revision",
      "final_recommended_fact": "2026年4月に石垣市学校給食弁当代替者補助要項を制定し、学校給食を食べず弁当を持参する中学生の保護者向けに月額3,250円の補助を講じた。",
      "decision_reason": "中学生の保護者全般への補助と誤解されないよう、答弁内にある対象条件を保持した。",
      "source_basis": "「食物アレルギーとやむを得ない理由により、学校給食を食べずに、弁当を持参対応する保護者への支援につきましては、令和8年4月に石垣市学校給食弁当代替者補助要項を制定し、中学生の保護者を対象に月額3250円を補助する負担軽減策を講じました。」",
      "speaker_role": "executive",
      "answer_anchor_source": "direct_item_match",
      "answer_anchor_confidence": "high",
      "confidence": "high",
      "unresolved_note": "「食物アレルギーとやむを得ない理由」の条件を、公開文へどの粒度で含めるかは proposal 作成時に再確認する。",
      "public_reflection_status": "not_reflected",
      "proposal_status": "not_created",
      "reviewed_at": "2026-07-11",
      "reviewer_note": "対象条件を落とさない wording を final candidate とした。"
    },
    {
      "decision_id": "r8-dai4-teireikai::ishigaki-r8-dai4-ippan-miyara-misao.item01::ishigaki-r8-dai4-teireikai.gq.ishigaki-r8-dai4-ippan-miyara-misao.u0004::cf02::decision-v1",
      "candidate_id": "ishigaki-r8-dai4-ippan-miyara-misao.item01::ishigaki-r8-dai4-teireikai.gq.ishigaki-r8-dai4-ippan-miyara-misao.u0004::cf02",
      "entry_id": "ishigaki-r8-dai4-ippan-miyara-misao.item01",
      "source_utterance_id": "ishigaki-r8-dai4-teireikai.gq.ishigaki-r8-dai4-ippan-miyara-misao.u0004",
      "council_member": "宮良操",
      "theme_group": "交通・航路",
      "theme": "定期航路事業について",
      "item_title": "定期航路事業について: 第三セクターにおける情報開示について / ふるさと納税石垣市まちづくり支援事業について / 今回の補正予算について / プロポーザル事業発注について / 令和7年度決算について / 出資金とこれまでの経営状況について",
      "original_candidate": "5月28日初就航から定期運行をしています",
      "source_review_proposed_fact": "八重山丸は2026年5月28日の初就航以降、定期運行を開始している。",
      "decision": "approve_with_revision",
      "final_recommended_fact": "石垣キールン定期航路は、2026年5月28日の初就航以降、定期運行を開始している。",
      "decision_reason": "support excerpt では船名「八重山丸」が直接確認できないため、既存データで多く使われている航路表記を主語にして根拠の確実な範囲へ寄せた。",
      "source_basis": "「まずは本線の就航をアピールするために、台湾初の集客が見込める運行スケジュールで、5月28日初就航から定期運行をしています。」",
      "speaker_role": "executive",
      "answer_anchor_source": "direct_item_match",
      "answer_anchor_confidence": "high",
      "confidence": "medium",
      "unresolved_note": "船名を使用する場合は、同一 source 内の船名明示箇所を別途根拠として確認する。",
      "public_reflection_status": "not_reflected",
      "proposal_status": "not_created",
      "reviewed_at": "2026-07-11",
      "reviewer_note": "repo 内では「石垣キールン定期航路」表記が複数存在したため、その表記へ統一した。"
    },
    {
      "decision_id": "r8-dai4-teireikai::ishigaki-r8-dai4-ippan-tonoshiro-konomi.item02::ishigaki-r8-dai4-teireikai.gq.ishigaki-r8-dai4-ippan-tonoshiro-konomi.u0011::cf01::decision-v1",
      "candidate_id": "ishigaki-r8-dai4-ippan-tonoshiro-konomi.item02::ishigaki-r8-dai4-teireikai.gq.ishigaki-r8-dai4-ippan-tonoshiro-konomi.u0011::cf01",
      "entry_id": "ishigaki-r8-dai4-ippan-tonoshiro-konomi.item02",
      "source_utterance_id": "ishigaki-r8-dai4-teireikai.gq.ishigaki-r8-dai4-ippan-tonoshiro-konomi.u0011",
      "council_member": "登野城このみ",
      "theme_group": "公共施設・都市整備",
      "theme": "石垣市民会館の安全で快適な利用環境の確保について",
      "item_title": "石垣市民会館の安全で快適な利用環境の確保について",
      "original_candidate": "令和2年度に最新式の温水洗浄便座機能を持つトイレを導入しました",
      "source_review_proposed_fact": "石垣市民会館では2020年度に温水洗浄便座機能を持つトイレを導入した。",
      "decision": "approve_as_written",